{
  "schemaVersion": "1.0.0",
  "kind": "agent-version",
  "agentId": "specialist-video-analysis",
  "group": "specialist",
  "displayName": "Video Analysis Specialist",
  "artifacts": {
    "promptTemplate": {
      "id": "specialist-video-analysis-prompt",
      "version": "1.0.0",
      "digest": "sha-256:0000000000000000000000000000000000000000000000000000000000000011"
    },
    "modelSelection": {
      "id": "simulated-default-model",
      "version": "1.0.0",
      "digest": "sha-256:0000000000000000000000000000000000000000000000000000000000000002"
    },
    "toolPolicy": {
      "id": "specialist-video-analysis-tools",
      "version": "1.0.0",
      "digest": "sha-256:0000000000000000000000000000000000000000000000000000000000000013"
    },
    "safetyPolicy": {
      "id": "specialist-safety",
      "version": "1.0.0",
      "digest": "sha-256:0000000000000000000000000000000000000000000000000000000000000004"
    }
  }
}
